{
  "$schema": "https://json-schema.org/draft/2020-12/schema",
  "$id": "urn:claude-agents:sidecar:1.0.0",
  "title": "claude-agents sidecar manifest",
  "description": "Index machine-lisible du catalogue claude-agents (ADR-0003). Encode de façon EXÉCUTABLE les 7 caractéristiques ISO/IEC 25012 retenues (ADR-0006) : 5 portées PLEINEMENT par ce schéma — complétude, cohérence, crédibilité, actualité, conformité (enum `type`) — plus 2 AMORCÉES ici par bien-formation (exactitude via `id` bien-formé, accessibilité via `path`/`source.file` anti-traversal) puis COMPLÉTÉES par des contrôles d'intégrité hors portée d'un JSON Schema (exactitude : référentielle dependsOn -> id existants + unicité des id ; accessibilité : joignabilité réelle de path). Cf. src/sidecar/integrity.ts. NB : la décomposition « 5 schéma + 2 intégrité » antérieure était inexacte (conformité omise, exactitude/accessibilité réparties) — corrigée suite à l'audit qualité ISO v1.",
  "type": "object",
  "additionalProperties": false,
  "required": ["schemaVersion", "catalog", "generatedAt", "assets"],
  "properties": {
    "schemaVersion": {
      "description": "Version SemVer du format sidecar lui-même.",
      "type": "string",
      "pattern": "^\\d+\\.\\d+\\.\\d+$"
    },
    "catalog": {
      "type": "object",
      "additionalProperties": false,
      "required": ["name", "version"],
      "properties": {
        "name": { "type": "string", "minLength": 1 },
        "version": {
          "description": "Tag épinglé du catalogue (ADR-0002). ISO 25012 : actualité.",
          "type": "string",
          "pattern": "^v\\d+\\.\\d+\\.\\d+$"
        }
      }
    },
    "generatedAt": {
      "description": "Horodatage ISO 8601 UTC de génération. ISO 25012 : actualité.",
      "type": "string",
      "pattern": "^\\d{4}-\\d{2}-\\d{2}T\\d{2}:\\d{2}:\\d{2}(\\.\\d+)?(Z|[+-]\\d{2}:\\d{2})$"
    },
    "assets": {
      "description": "Liste des assets du catalogue (au moins un). ISO 25012 : complétude.",
      "type": "array",
      "minItems": 1,
      "items": { "$ref": "#/$defs/asset" }
    }
  },
  "$defs": {
    "asset": {
      "type": "object",
      "additionalProperties": false,
      "required": ["id", "type", "path", "title", "description", "catalogVersion", "source"],
      "properties": {
        "id": {
          "description": "Identifiant unique de l'asset. ISO 25012 : exactitude (bien-formé). L'unicité globale relève d'un test complémentaire.",
          "type": "string",
          "pattern": "^[A-Za-z0-9][A-Za-z0-9._/-]*$"
        },
        "type": {
          "description": "Format ouvert de l'asset. ISO 25012 : conformité.",
          "type": "string",
          "enum": ["agent", "skill", "workflow"]
        },
        "path": {
          "description": "Chemin relatif vers le fichier prose source (sans '/' initial ni '..'). ISO 25012 : accessibilité (bien-formé). La joignabilité réelle relève d'un test complémentaire.",
          "type": "string",
          "minLength": 1,
          "pattern": "^(?!/)(?!.*\\.\\.).+$"
        },
        "title": { "type": "string", "minLength": 1 },
        "description": { "type": "string", "minLength": 1 },
        "catalogVersion": {
          "description": "Tag du catalogue dont l'entrée est issue. ISO 25012 : actualité.",
          "type": "string",
          "pattern": "^v\\d+\\.\\d+\\.\\d+$"
        },
        "source": {
          "description": "Provenance auditée. ISO 25012 : crédibilité — toute entrée machine trace vers une source prose + un tag.",
          "type": "object",
          "additionalProperties": false,
          "required": ["file", "catalogTag"],
          "properties": {
            "file": {
              "type": "string",
              "minLength": 1,
              "pattern": "^(?!/)(?!.*\\.\\.).+$"
            },
            "catalogTag": {
              "type": "string",
              "pattern": "^v\\d+\\.\\d+\\.\\d+$"
            }
          }
        },
        "dependsOn": {
          "description": "Arêtes de dépendance (ids d'autres assets). ISO 25012 : cohérence. L'existence des cibles relève d'un test complémentaire (exactitude référentielle).",
          "type": "array",
          "items": { "type": "string", "pattern": "^[A-Za-z0-9][A-Za-z0-9._/-]*$" }
        }
      },
      "allOf": [
        {
          "if": {
            "required": ["type"],
            "properties": { "type": { "const": "workflow" } }
          },
          "then": {
            "required": ["dependsOn"],
            "properties": { "dependsOn": { "type": "array", "minItems": 1 } }
          }
        },
        {
          "if": {
            "required": ["type"],
            "properties": { "type": { "const": "agent" } }
          },
          "then": {
            "required": ["dependsOn"]
          }
        }
      ]
    }
  }
}
